{
  "artifact_type": "agent-session-record",
  "stream_format_version": 1,
  "stream_id": "ASTR-V102-PROVIDER-PILOT-SELECTION",
  "recorded_at": "2026-08-01T01:55:00.000Z",
  "session_id": "SESS-V102-PROVIDER-PILOT-SELECTION",
  "parent_session_id": null,
  "actor_ref": "parent-codex",
  "role_ref": "orchestrator",
  "provider": "local",
  "model": "unspecified",
  "events": [
    {
      "event_id": "EVT-V102-1",
      "event_type": "prompt",
      "occurred_at": "2026-08-01T01:55:00.000Z",
      "summary": "AOF heartbeat requested moving from v10.1 validation contract to the next roadmap release.",
      "artifact_refs": [
        ".aof/goals/next-value-slice.json"
      ],
      "tool_name": "organization-status",
      "safety_level": "safe_read",
      "approval_policy": "approved"
    },
    {
      "event_id": "EVT-V102-2",
      "event_type": "tool_call",
      "occurred_at": "2026-08-01T01:55:00.000Z",
      "summary": "AOF runtime identified v10.2 external provider integration pilot selection as the next frontier.",
      "artifact_refs": [
        "docs/vnext-roadmap.md",
        "docs/vnext-release-plan.md"
      ],
      "tool_name": "roadmap-status",
      "safety_level": "safe_read",
      "approval_policy": "approved"
    },
    {
      "event_id": "EVT-V102-3",
      "event_type": "artifact_write",
      "occurred_at": "2026-08-01T01:55:00.000Z",
      "summary": "AOF recorded TASK-122 and release docs for the GitHub read-first provider pilot selection contract.",
      "artifact_refs": [
        ".aof/tasks/done/TASK-122.json",
        "docs/v10.2-release-definition.md",
        "docs/v10.2.0-release-notes.md"
      ],
      "tool_name": null,
      "safety_level": "safe_local_write",
      "approval_policy": "approved"
    },
    {
      "event_id": "EVT-V102-4",
      "event_type": "verification_result",
      "occurred_at": "2026-08-01T01:55:00.000Z",
      "summary": "Release readiness requires runtime audits, npm test, smoke, clean checkout, and GitHub Actions.",
      "artifact_refs": [
        "docs/v10.2-release-checklist.md"
      ],
      "tool_name": "release-state-audit",
      "safety_level": "safe_read",
      "approval_policy": "approved"
    }
  ],
  "links": {
    "task_refs": [
      ".aof/tasks/done/TASK-122.json"
    ],
    "requirement_refs": [
      "docs/v10.2-release-definition.md"
    ],
    "test_evidence_refs": [
      ".aof/context/active/release-state-audit.json"
    ],
    "commit_refs": [],
    "pr_refs": [],
    "artifact_refs": [
      "docs/v10.2.0-release-notes.md",
      "docs/aof-capability-matrix.md"
    ]
  },
  "risk_candidates": [
    "Provider pilot selection may be mistaken for completed provider integration or write authorization."
  ],
  "decision_candidates": [
    "Select GitHub read-first as the first bounded external provider pilot candidate."
  ],
  "release_ready_evidence": {
    "claim": "Release readiness depends on independent verification commands and GitHub Actions, not this session alone.",
    "evidence_refs": [
      "docs/v10.2-release-checklist.md"
    ],
    "verdict": "not_ready"
  },
  "source_task_id": "TASK-122",
  "source_parent_session_id": "SESS-V102-PROVIDER-PILOT-SELECTION",
  "source_decision_record_id": null
}
